{
  "$schema": "https://json-schema.org/draft/2020-12/schema",
  "title": "HYAIResultBundle",
  "type": "object",
  "additionalProperties": false,
  "required": [
    "schema_version",
    "result_bundle_id",
    "task_bundle_ref",
    "goal_ref",
    "status",
    "verified_criteria",
    "artifacts",
    "execution_metadata",
    "content_digest"
  ],
  "properties": {
    "schema_version": {
      "type": "string",
      "enum": ["1.0.0"]
    },
    "result_bundle_id": {
      "type": "string",
      "pattern": "^resultbundle_[a-f0-9]{8,32}$"
    },
    "task_bundle_ref": {
      "type": "string",
      "pattern": "^taskbundle_[a-f0-9]{8,32}$"
    },
    "goal_ref": {
      "type": "string",
      "pattern": "^goal_[a-f0-9]{8,32}$"
    },
    "status": {
      "type": "string",
      "enum": ["COMPLETED_SUCCESS", "FAILED_VERIFICATION", "ABORTED"]
    },
    "verified_criteria": {
      "type": "array",
      "minItems": 1,
      "items": {
        "type": "object",
        "additionalProperties": false,
        "required": ["criterion_id", "status", "verification_output", "verified_at"],
        "properties": {
          "criterion_id": { "type": "string" },
          "status": { "type": "string", "enum": ["PASS", "FAIL"] },
          "verification_output": { "type": "string" },
          "verified_at": { "type": "string" }
        }
      }
    },
    "artifacts": {
      "type": "array",
      "items": {
        "type": "object",
        "additionalProperties": false,
        "required": ["file_path", "sha256", "size_bytes"],
        "properties": {
          "file_path": { "type": "string" },
          "sha256": { "type": "string", "pattern": "^[a-f0-9]{64}$" },
          "size_bytes": { "type": "integer", "minimum": 0 }
        }
      }
    },
    "execution_metadata": {
      "type": "object",
      "additionalProperties": false,
      "required": ["coordinator", "coder", "duration_seconds", "timestamp_start", "timestamp_end"],
      "properties": {
        "coordinator": { "type": "string" },
        "coder": { "type": "string" },
        "duration_seconds": { "type": "number" },
        "timestamp_start": { "type": "string" },
        "timestamp_end": { "type": "string" }
      }
    },
    "content_digest": {
      "type": "object",
      "additionalProperties": false,
      "required": ["algorithm", "encoding", "value"],
      "properties": {
        "algorithm": { "type": "string", "enum": ["sha256"] },
        "encoding": { "type": "string", "enum": ["hex"] },
        "value": { "type": "string", "pattern": "^[a-f0-9]{64}$" }
      }
    }
  }
}
