{
  "schema_version": "1.0.0",
  "result_bundle_id": "resultbundle_9e4b102fc831",
  "task_bundle_ref": "taskbundle_7f3a9e102bc4",
  "goal_ref": "goal_c48b10e9f123",
  "status": "COMPLETED_SUCCESS",
  "verified_criteria": [
    {
      "criterion_id": "CRIT-01",
      "status": "PASS",
      "verification_output": "RollingLatencyTracker class exists with bounded FIFO deque buffer and sample validation (ms).",
      "verified_at": "2026-10-08T06:20:36.153423+00:00"
    },
    {
      "criterion_id": "CRIT-02",
      "status": "PASS",
      "verification_output": "Exact min, max, mean, p50, p95, and p99 percentiles computed via linear interpolation. Empty buffer raises ValueError.",
      "verified_at": "2026-10-08T06:20:36.153423+00:00"
    },
    {
      "criterion_id": "CRIT-03",
      "status": "PASS",
      "verification_output": "Rolling window correctly evicts oldest samples preserving FIFO deque ordering.",
      "verified_at": "2026-10-08T06:20:36.153423+00:00"
    },
    {
      "criterion_id": "CRIT-04",
      "status": "PASS",
      "verification_output": "Pytest suite executed cleanly: 16 passed in 0.02s. Output:\n============================= test session starts =============================\nplatform win32 -- Python 3.11.15, pytest-9.1.1, pluggy-1.6.0 -- C:\\Users\\THAIPC\\AppData\\Local\\hermes\\hermes-agent\\venv\\Scripts\\python.exe\ncachedir: .pytest_cache\nrootdir: E:\\hyai-wiring\nconfigfile: pytest.ini\nplugins: anyio-4.15.1, timeout-2.4.0, respx-0.22.0\ncollecting ... collected 16 items\n\ntests/test_latency_stats.py::test_empty_tracker_raises_value_error PASSED [  6%]\ntests/test_latency_stats.py::test_single_sample_stats PASSED             [ 12%]\ntests/test_latency_stats.py::test_multiple_samples_percentiles_accuracy[samples0-expected0] PASSED [ 18%]\ntests/test_latency_stats.py::test_multiple_samples_percentiles_accuracy[samples1-expected1] PASSED [ 25%]\ntests/test_latency_stats.py::test_multiple_samples_percentiles_accuracy[samples2-expected2] PASSED [ 31%]\ntests/test_latency_stats.py::test_multiple_samples_percentiles_accuracy[samples3-expected3] PASSED [ 37%]\ntests/test_latency_stats.py::test_window_capacity_eviction_fifo PASSED   [ 43%]\ntests/test_latency_stats.py::test_invalid_inputs_raise_value_error PASSED [ 50%]\ntests/test_latency_stats.py::test_clear_resets_tracker PASSED            [ 56%]\ntests/test_latency_stats.py::test_repeated_samples_and_float_results[0.0] PASSED [ 62%]\ntests/test_latency_stats.py::test_repeated_samples_and_float_results[0.125] PASSED [ 68%]\ntests/test_latency_stats.py::test_repeated_samples_and_float_results[7] PASSED [ 75%]\ntests/test_latency_stats.py::test_window_size_one_keeps_latest_sample PASSED [ 81%]\ntests/test_latency_stats.py::test_default_window_capacity PASSED         [ 87%]\ntests/test_latency_stats.py::test_get_stats_preserves_fifo_order_and_returns_independent_dict PASSED [ 93%]\ntests/test_latency_stats.py::test_trackers_have_independent_buffers PASSED [100%]\n\n============================= 16 passed in 0.02s ==============================\n",
      "verified_at": "2026-10-08T06:20:36.153423+00:00"
    }
  ],
  "artifacts": [
    {
      "file_path": "src/metrics/latency_stats.py",
      "sha256": "aaa4e8fdaccccfecc848059ee799d58c578414d4a8c42327f289ab611af8fe09",
      "size_bytes": 1924
    },
    {
      "file_path": "tests/test_latency_stats.py",
      "sha256": "7f1a28cfaaad271cb03138791ed6ca6640b813e6aba9fe5921f73f4acba5c30b",
      "size_bytes": 4917
    }
  ],
  "execution_metadata": {
    "coordinator": "Hermes Agent (gemini-3.8-flash-high)",
    "coder": "OpenAI Codex CLI (gpt-5.6-terra)",
    "duration_seconds": 42.5,
    "timestamp_start": "2026-10-08T05:15:00Z",
    "timestamp_end": "2026-10-08T05:22:00Z"
  },
  "content_digest": {
    "algorithm": "sha256",
    "encoding": "hex",
    "value": "e8688836ff691efa906d77efab3340baec15ed5f789d3dffb09bb9c93b025343"
  }
}